body,title,url"Al décimo día de dar positivo por coronavirus, Donald Trump se declaró “inmune”. El parte médico compartido el sábado por la noche indicaba que el presidente estadounidense ya no era un riesgo de transmisión para los demás, pero no especificaba si seguía infectado ni hacía referencia alguna a la inmunidad. Sin embargo, el republicano se encargó de difundir el domingo por la mañana por televisión y Twitter que ya no se podía volver a contagiar. La red social acompañó la publicación del republicano de un mensaje en el que advertía de que se trataba de una “información engañosa y potencialmente dañina” relacionada con la covid-19. Es la segunda vez en menos de una semana que la plataforma advierte sobre un mensaje del mandatario por el mismo motivo.",,https://elpais.com/internacional/elecciones-usa/2020-10-11/twitter-advierte-a-trump-por-dar-informacion-enganosa-al-decir-que-es-inmune-a-la-covid.html
"“Lloré por lo que me estaba tocando vivir”. Luis Suárez nació en Salto (Uruguay), vivió una infancia dura en Montevideo, le cambió la vida en Groninga (Holanda), destacó en Ámsterdam, se hizo mundialmente famoso en Liverpool y se enamoró de Barcelona. No fue fácil para el delantero uruguayo su escalada hasta el Camp Nou, mucho menos su despedida después de haberse convertido en el tercer máximo artillero del club azulgrana (198 goles). “Llegar al Barça fue un sueño hecho realidad. No me imaginaba llegar a estos números”, subrayó Suárez en su despedida. Cuando los futbolistas hablan de sueños, parecen frases sacadas del cajón de los tópicos. No es el caso de Suárez. Al menos, cuando hace referencia a la capital catalana. Un vínculo que nació cuando ni siquiera se atrevía a considerarse futbolista. Ahora, le tocará conquistar Madrid de la mano de Diego Pablo Simeone en el Wanda Metropolitano.","“Tendremos una crisis muy aguda, pero será breve”",https://elpais.com/gente/2020-10-11/la-pasion-de-luis-suarez-por-barcelona-mas-alla-del-futbol.html
"De saborear las mieles del éxito y del glamur de las pasarelas de Nueva York a tocar fondo en uno de los barrios más pobres de Río de Janeiro a los 26 años. Esto es lo que le ha ocurrido a la modelo brasileña Eloísa Fontes, que hace un año desapareció de su casa de la Gran Manzana y la pasada semana fue encontrada deambulando, desorientada y semidesnuda por las calles de Cantagalo, una favela situada entre los barrios de Copacabana e Ipanema. La joven ya ha sido internada en un centro psiquiátrico.","“Tendremos una crisis muy aguda, pero será breve”",https://elpais.com/gente/2020-10-12/la-modelo-brasilena-que-ha-pasado-del-glamur-de-las-pasarelas-al-psiquiatrico.html
"La Mesa del Congreso tiene previsto ratificar este martes la propuesta de su presidenta, Meritxell Batet, para que la moción de censura presentada a finales de septiembre por Vox se debata los días 21 y 22 de octubre. La moción, la quinta de la reciente etapa democrática, no tiene ninguna posibilidad de prosperar y servirá para dar proyección a la formación ultra, poner en apuros al PP en su voto entre el no y la abstención, y tensionar más el ambiente político del país cuando España sigue en plena crisis sanitaria y sufre los efectos de la segunda ola de la pandemia. Vox no tendrá ni siquiera el apoyo del resto de partidos de la derecha.",,https://elpais.com/espana/2020-10-12/la-mocion-de-censura-de-vox-se-debatira-el-21-y-22-de-octubre-en-plena-crisis-por-la-pandemia.html
"¿Cómo detectar que hemos perdido el control? Lo primero suele ser experimentar miedo a la desconexión.
				                    Foto: Getty
",,https://smoda.elpais.com/moda/5-cambios-faciles-para-retomar-el-control-emocional-sobre-las-redes-sociales/
"Procusto, según la mitología griega, era un ladino posadero que recibía huéspedes en una casita perdida en las colinas salpicadas a lo largo del camino hacia Atenas. Adelantándose miles de años a los psicópatas de las películas de terror, Procusto se dedicaba a despedazar, por método, a sus clientes. Su técnica de asesinato era singular. Hacía acostarse a los visitantes en una cama dispuesta para tal efecto y, tomándolos por sorpresa, los amarraba de pies y manos....",,https://elpais.com/mexico/opinion/2020-10-12/procusto-presidente.html
"Los estadounidenses Paul R. Milgrom y Robert B. Wilson, matemáticos y profesores de la Universidad de Stanford, obtuvieron este lunes el Premio Nobel de Economía “por sus mejoras en la teoría de subastas y la invención de nuevos formatos de subastas”, según anunció la Real Academia de las Ciencias Sueca. Las investigaciones de ambos revolucionaron dicho campo, crearon un mercado más eficiente para compradores y vendedores, y contribuyeron a maximizar los ingresos de las arcas públicas en el mercado eléctrico, petrolífero o de telecomunicaciones. La decisión consolida el dominio norteamericano en el galardón.",,https://elpais.com/economia/2020-10-12/premio-nobel-de-economia-2020.html
"“He resuelto más de dos millones de captchas en tres años”, dice el venezolano Francisco J. Esaa, de 19 años. “Hay un programa que permite medir los captchas por minuto que haces. Los más rápidos al teclado son capaces de hacer 20-25 por minuto y 1.500 hora, pero la mayoría se enfoca en hacer 1.000 de media”, añade. Los captchas y recaptchas son pruebas que no puede resolver una máquina y que las plataformas de Internet ponen en su página de registros para comprobar que quien accede es un humano. Es casi el único obstáculo que impide la automatización completa del p...","“Tendremos una crisis muy aguda, pero será breve”",https://elpais.com/tecnologia/2020-10-10/me-gano-la-vida-resolviendo-captchas-asi-es-la-vida-en-el-sotano-de-internet.html
"Newstead Abbey, 14 de diciembre de 1808","“Tendremos una crisis muy aguda, pero será breve”",https://elpais.com/cultura/2020/10/09/babelia/1602242640_587509.html
1 de 50,,https://smoda.elpais.com/moda/vestidos-novia-miticos-inspiracion/
"Menos lluvia, más incendios, poca selva; poca selva, más incendios, menos lluvia. Ese es el círculo vicioso que tiene en riesgo la estabilidad y la conservación de la Amazonía. El 40% de la selva tropical más grande del mundo puede convertirse en una sabana mucho antes de lo que se creía por culpa del cambio climático y la deforestación, según reveló una investigación publicada en Nature Communications.","“Tendremos una crisis muy aguda, pero será breve”",https://elpais.com/ciencia/2020-10-11/el-punto-de-no-retorno-de-los-bosques-tropicales.html
